{
  "@context": [
    "https://www.w3.org/ns/credentials/v2",
    "https://raw.githubusercontent.com/nfh-trust-labs/opencred-vc-schemas/main/schemas/test-result/v1/context.jsonld"
  ],
  "id": "urn:uuid:00000000-0000-4000-8000-000000000001",
  "type": [
    "VerifiableCredential",
    "TestResultCredential"
  ],
  "issuer": {
    "id": "did:web:issuer.example",
    "name": "Example Issuer"
  },
  "validFrom": "2026-04-08T00:00:00Z",
  "credentialSubject": {
    "id": "did:example:subject",
    "reportId": "LAB-2026-04-00123",
    "testCode": {
      "system": "http://loinc.org",
      "code": "58410-2",
      "display": "Complete blood count (hemogram) panel"
    },
    "category": "laboratory",
    "subject": {
      "name": "Marie Curie",
      "dateOfBirth": "1975-11-07"
    },
    "effectiveDateTime": "2026-04-05T08:00:00Z",
    "issued": "2026-04-05T14:30:00Z",
    "performer": {
      "name": "Acme Diagnostics Lab",
      "accreditationId": "ISO-15189-2024-0042",
      "accreditationBody": "UKAS"
    },
    "results": [
      {
        "code": {
          "system": "http://loinc.org",
          "code": "718-7",
          "display": "Hemoglobin [Mass/volume] in Blood"
        },
        "value": {
          "quantity": 14.2,
          "unit": "g/dL",
          "referenceRange": {
            "low": 12,
            "high": 16,
            "unit": "g/dL"
          }
        },
        "interpretation": "normal",
        "status": "final"
      }
    ],
    "conclusion": "All values within normal range.",
    "specimenType": "blood"
  }
}
